0xB400: 0x00
0xB401: 0x00
0xB402: 0x01
0xB403: 0x01
0xB404: 0x01
0xB405: 0x00
0xB406: 0x00
0xB407: 0x00
0xB408: 0x00
0xB409: 0x00
0xB40A: 0x00
0xB40B: 0x00
0xB40C: 0x00
0xB40D: 0x00
0xB40E: 0x00
0xB40F: 0x00
0xB410: 0x1B
0xB411: 0x21
0xB412: 0x24
0xB413: 0x63
0xB414: 0x00
0xB415: 0x06
0xB416: 0x04
0xB417: 0x00
0xB418: 0x24
0xB419: 0x63
0xB41A: 0x1B
0xB41B: 0x21
0xB41C: 0x00
0xB41D: 0x00
0xB41E: 0x00
0xB41F: 0x00
0xB420: 0x1B
0xB421: 0x21
0xB422: 0x24
0xB423: 0x63
0xB424: 0x00
0xB425: 0x06
0xB426: 0x04
0xB427: 0x00
0xB428: 0x24
0xB429: 0x63
0xB42A: 0x1B
0xB42B: 0x21
0xB42C: 0x00
0xB42D: 0x00
0xB42E: 0x00
0xB42F: 0x00
0xB430: 0x04
0xB431: 0x0E
0xB432: 0x07
0xB433: 0x00
0xB434: 0x0E
0xB435: 0x00
0xB436: 0xEE
0xB437: 0x00
0xB438: 0x00
0xB439: 0x00
0xB43A: 0x00
0xB43B: 0x00
0xB43C: 0x00
0xB43D: 0x00
0xB43E: 0x00
0xB43F: 0x00
0xB440: 0x0F
0xB441: 0x00
0xB442: 0x00
0xB443: 0x00
0xB444: 0x00
0xB445: 0x00
0xB446: 0x00
0xB447: 0x00
0xB448: 0x00
0xB449: 0x00
0xB44A: 0x00
0xB44B: 0x00
0xB44C: 0x00
0xB44D: 0x00
0xB44E: 0x00
0xB44F: 0x00
0xB450: 0x01
0xB451: 0x01
0xB452: 0x01
0xB453: 0x01
0xB454: 0x1F
0xB455: 0x10
0xB456: 0x1F
0xB457: 0x10
0xB458: 0x1F
0xB459: 0x10
0xB45A: 0x1F
0xB45B: 0x10
0xB45C: 0x0F
0xB45D: 0x00
0xB45E: 0x00
0xB45F: 0x00
0xB460: 0xC0
0xB461: 0x32
0xB462: 0xC0
0xB463: 0x0C
0xB464: 0x64
0xB465: 0x00
0xB466: 0x00
0xB467: 0x00
0xB468: 0x00
0xB469: 0x00
0xB46A: 0x00
0xB46B: 0x00
0xB46C: 0x00
0xB46D: 0x00
0xB46E: 0x00
0xB46F: 0x00
0xB470: 0x00
0xB471: 0x00
0xB472: 0x00
0xB473: 0x00
0xB474: 0x00
0xB475: 0x00
0xB476: 0x00
0xB477: 0x00
0xB478: 0x00
0xB479: 0x00
0xB47A: 0x00
0xB47B: 0x00
0xB47C: 0x00
0xB47D: 0x00
0xB47E: 0x00
0xB47F: 0x00
0xB480: 0x01
0xB481: 0x00
0xB482: 0xF1
0xB483: 0x00
0xB484: 0x00
0xB485: 0x00
0xB486: 0x00
0xB487: 0x00
0xB488: 0x00
0xB489: 0x00
0xB48A: 0x00
0xB48B: 0x00
0xB48C: 0x00
0xB48D: 0x00
0xB48E: 0x00
0xB48F: 0x00
0xB490: 0x00
0xB491: 0x00
0xB492: 0x00
0xB493: 0x00
0xB494: 0x00
0xB495: 0x00
0xB496: 0x00
0xB497: 0x00
0xB498: 0x00
0xB499: 0x00
0xB49A: 0x00
0xB49B: 0x00
0xB49C: 0x00
0xB49D: 0x00
0xB49E: 0x00
0xB49F: 0x00
0xB4A0: 0x00
0xB4A1: 0x00
0xB4A2: 0x00
0xB4A3: 0x00
0xB4A4: 0x00
0xB4A5: 0x00
0xB4A6: 0x00
0xB4A7: 0x00
0xB4A8: 0x00
0xB4A9: 0x00
0xB4AA: 0x00
0xB4AB: 0x00
0xB4AC: 0x00
0xB4AD: 0x00
0xB4AE: 0x00
0xB4AF: 0x00
0xB4B0: 0x00
0xB4B1: 0x00
0xB4B2: 0x00
0xB4B3: 0x00
0xB4B4: 0x00
0xB4B5: 0x00
0xB4B6: 0x00
0xB4B7: 0x00
0xB4B8: 0x00
0xB4B9: 0x00
0xB4BA: 0x00
0xB4BB: 0x00
0xB4BC: 0x00
0xB4BD: 0x00
0xB4BE: 0x00
0xB4BF: 0x00
0xB4C0: 0x00
0xB4C1: 0x00
0xB4C2: 0x00
0xB4C3: 0x00
0xB4C4: 0x00
0xB4C5: 0x00
0xB4C6: 0x00
0xB4C7: 0x00
0xB4C8: 0x00
0xB4C9: 0x00
0xB4CA: 0x00
0xB4CB: 0x00
0xB4CC: 0x00
0xB4CD: 0x00
0xB4CE: 0x00
0xB4CF: 0x00
0xB4D0: 0x00
0xB4D1: 0x00
0xB4D2: 0x00
0xB4D3: 0x00
0xB4D4: 0x00
0xB4D5: 0x00
0xB4D6: 0x00
0xB4D7: 0x00
0xB4D8: 0x00
0xB4D9: 0x00
0xB4DA: 0x00
0xB4DB: 0x00
0xB4DC: 0x00
0xB4DD: 0x00
0xB4DE: 0x00
0xB4DF: 0x00
0xB4E0: 0x00
0xB4E1: 0x00
0xB4E2: 0x00
0xB4E3: 0x00
0xB4E4: 0x00
0xB4E5: 0x00
0xB4E6: 0x00
0xB4E7: 0x00
0xB4E8: 0x00
0xB4E9: 0x00
0xB4EA: 0x00
0xB4EB: 0x00
0xB4EC: 0x00
0xB4ED: 0x00
0xB4EE: 0x00
0xB4EF: 0x00
0xB4F0: 0x00
0xB4F1: 0x00
0xB4F2: 0x00
0xB4F3: 0x00
0xB4F4: 0x00
0xB4F5: 0x00
0xB4F6: 0x00
0xB4F7: 0x00
0xB4F8: 0x00
0xB4F9: 0x00
0xB4FA: 0x00
0xB4FB: 0x00
0xB4FC: 0xFF
0xB4FD: 0xFF
0xB4FE: 0x00
0xB4FF: 0x00
0xC600: 0x00
0xC601: 0x00
0xC602: 0x00
0xC603: 0x00
0xC604: 0x00
0xC605: 0x00
0xC606: 0x00
0xC607: 0x00
0xC608: 0x00
0xC609: 0x00
0xC60A: 0x00
0xC60B: 0x00
0xC60C: 0x00
0xC60D: 0x00
0xC60E: 0x00
0xC60F: 0x00
0xC610: 0x01
0xC611: 0x00
0xC612: 0x00
0xC613: 0x00
0xC614: 0x00
0xC615: 0x00
0xC616: 0x00
0xC617: 0x00
0xC618: 0x00
0xC619: 0x00
0xC61A: 0x00
0xC61B: 0x00
0xC61C: 0x00
0xC61D: 0x00
0xC61E: 0x00
0xC61F: 0x00
0xC620: 0x00
0xC621: 0x00
0xC622: 0x00
0xC623: 0x15
0xC624: 0x03
0xC625: 0x02
0xC626: 0x01
0xC627: 0x08
0xC628: 0x0B
0xC629: 0x13
0xC62A: 0x14
0xC62B: 0x04
0xC62C: 0x00
0xC62D: 0x07
0xC62E: 0x0C
0xC62F: 0x00
0xC630: 0x00
0xC631: 0x00
0xC632: 0x00
0xC633: 0x00
0xC634: 0x07
0xC635: 0x00
0xC636: 0x0D
0xC637: 0x0D
0xC638: 0x0E
0xC639: 0x00
0xC63A: 0x00
0xC63B: 0x00
0xC63C: 0x00
0xC63D: 0x00
0xC63E: 0x00
0xC63F: 0x00
0xC640: 0x09
0xC641: 0x0A
0xC642: 0x0C
0xC643: 0x07
0xC644: 0x06
0xC645: 0x07
0xC646: 0x05
0xC647: 0x08
0xC648: 0x0E
0xC649: 0x16
0xC64A: 0x17
0xC64B: 0x1F
0xC64C: 0x1F
0xC64D: 0x16
0xC64E: 0x07
0xC64F: 0x00
0xC650: 0x93
0xC651: 0xBE
0xC652: 0x3F
0xC653: 0x0E
0xC654: 0x01
0xC655: 0x00
0xC656: 0x20
0xC657: 0x00
0xC658: 0x00
0xC659: 0x01
0xC65A: 0x00
0xC65B: 0x28
0xC65C: 0x00
0xC65D: 0x00
0xC65E: 0x0F
0xC65F: 0xFF
0xC660: 0xFF
0xC661: 0xFF
0xC662: 0x0F
0xC663: 0x02
0xC664: 0x0F
0xC665: 0x04
0xC666: 0x04
0xC667: 0x04
0xC668: 0x04
0xC669: 0x04
0xC66A: 0x04
0xC66B: 0x04
0xC66C: 0x04
0xC66D: 0x3F
0xC66E: 0x04
0xC66F: 0x00
0xC670: 0x00
0xC671: 0x01
0xC672: 0x1E
0xC673: 0x1E
0xC674: 0x1E
0xC675: 0x1E
0xC676: 0x1E
0xC677: 0x1E
0xC678: 0x03
0xC679: 0x1E
0xC67A: 0x1E
0xC67B: 0x1E
0xC67C: 0x01
0xC67D: 0x02
0xC67E: 0x1E
0xC67F: 0x1E
0xC680: 0xAF
0xC681: 0xFF
0xC682: 0x0A
0xC683: 0xFF
0xC684: 0xAA
0xC685: 0xFF
0xC686: 0xAB
0xC687: 0xFF
0xC688: 0x00
0xC689: 0x00
0xC68A: 0x00
0xC68B: 0x00
0xC68C: 0x00
0xC68D: 0x00
0xC68E: 0x00
0xC68F: 0x00
0xC690: 0x00
0xC691: 0x00
0xC692: 0x00
0xC693: 0x00
0xC694: 0x00
0xC695: 0x00
0xC696: 0x00
0xC697: 0x00
0xC698: 0x63
0xC699: 0x00
0xC69A: 0x00
0xC69B: 0x00
0xC69C: 0x00
0xC69D: 0x00
0xC69E: 0x00
0xC69F: 0x00
0xC6A0: 0x00
0xC6A1: 0x00
0xC6A2: 0x00
0xC6A3: 0x00
0xC6A4: 0x00
0xC6A5: 0x00
0xC6A6: 0x00
0xC6A7: 0x00
0xC6A8: 0x01
0xC6A9: 0x00
0xC6AA: 0x00
0xC6AB: 0x00
0xC6AC: 0x00
0xC6AD: 0x00
0xC6AE: 0x00
0xC6AF: 0x00
0xC6B0: 0x00
0xC6B1: 0x00
0xC6B2: 0x00
0xC6B3: 0x15
0xC6B4: 0x00
0xC6B5: 0x20
0xC6B6: 0x00
0xC6B7: 0x00
0xC6B8: 0x00
0xC6B9: 0x00
0xC6BA: 0x00
0xC6BB: 0x00
0xC6BC: 0x00
0xC6BD: 0x01
0xC6BE: 0x00
0xC6BF: 0x00
0xC6C0: 0x00
0xC6C1: 0x00
0xC6C2: 0x00
0xC6C3: 0x00
0xC6C4: 0x00
0xC6C5: 0x00
0xC6C6: 0x00
0xC6C7: 0x00
0xC6C8: 0x00
0xC6C9: 0x00
0xC6CA: 0x00
0xC6CB: 0x00
0xC6CC: 0x00
0xC6CD: 0x00
0xC6CE: 0x00
0xC6CF: 0x00
0xC6D0: 0x04
0xC6D1: 0x04
0xC6D2: 0x03
0xC6D3: 0xDD
0xC6D4: 0x00
0xC6D5: 0x00
0xC6D6: 0x00
0xC6D7: 0x00
0xC6D8: 0x00
0xC6D9: 0x00
0xC6DA: 0x00
0xC6DB: 0x00
0xC6DC: 0x04
0xC6DD: 0x03
0xC6DE: 0x00
0xC6DF: 0x00
0xC6E0: 0x00
0xC6E1: 0x02
0xC6E2: 0x02
0xC6E3: 0x07
0xC6E4: 0x00
0xC6E5: 0x00
0xC6E6: 0x00
0xC6E7: 0x00
0xC6E8: 0x00
0xC6E9: 0x00
0xC6EA: 0x00
0xC6EB: 0x00
0xC6EC: 0x00
0xC6ED: 0x00
0xC6EE: 0x00
0xC6EF: 0x00
0xC6F0: 0x00
0xC6F1: 0x00
0xC6F2: 0x00
0xC6F3: 0x00
0xC6F4: 0x00
0xC6F5: 0x00
0xC6F6: 0x00
0xC6F7: 0x00
0xC6F8: 0x00
0xC6F9: 0x00
0xC6FA: 0x00
0xC6FB: 0x00
0xC6FC: 0x00
0xC6FD: 0x00
0xC6FE: 0x00
0xC6FF: 0x00
0xCA00: 0x00
0xCA01: 0x00
0xCA02: 0x00
0xCA03: 0x00
0xCA04: 0xFF
0xCA05: 0xFF
0xCA06: 0x21
0xCA07: 0x01
0xCA08: 0x4D
0xCA09: 0xFF
0xCA0A: 0x00
0xCA0B: 0x00
0xCA0C: 0xF6
0xCA0D: 0xEF
0xCA0E: 0x00
0xCA0F: 0x08
0xCA10: 0x00
0xCA11: 0x00
0xCA12: 0x00
0xCA13: 0x00
0xCA14: 0x00
0xCA15: 0x00
0xCA16: 0x00
0xCA17: 0x00
0xCA18: 0x00
0xCA19: 0x00
0xCA1A: 0x00
0xCA1B: 0x00
0xCA1C: 0x00
0xCA1D: 0x00
0xCA1E: 0x00
0xCA1F: 0x00
0xCA20: 0x00
0xCA21: 0x00
0xCA22: 0x00
0xCA23: 0x00
0xCA24: 0x00
0xCA25: 0x00
0xCA26: 0x00
0xCA27: 0x00
0xCA28: 0x00
0xCA29: 0x00
0xCA2A: 0x00
0xCA2B: 0x00
0xCA2C: 0x00
0xCA2D: 0x00
0xCA2E: 0x02
0xCA2F: 0x00
0xCA30: 0x00
0xCA31: 0x00
0xCA32: 0x00
0xCA33: 0x00
0xCA34: 0x00
0xCA35: 0x00
0xCA36: 0x00
0xCA37: 0x00
0xCA38: 0x00
0xCA39: 0x00
0xCA3A: 0x00
0xCA3B: 0x00
0xCA3C: 0x00
0xCA3D: 0x00
0xCA3E: 0x00
0xCA3F: 0x00
0xCA40: 0x00
0xCA41: 0x00
0xCA42: 0x00
0xCA43: 0x00
0xCA44: 0x00
0xCA45: 0x00
0xCA46: 0x00
0xCA47: 0x00
0xCA48: 0x00
0xCA49: 0x00
0xCA4A: 0x00
0xCA4B: 0x00
0xCA4C: 0x00
0xCA4D: 0x00
0xCA4E: 0x00
0xCA4F: 0x00
0xCA50: 0x00
0xCA51: 0x00
0xCA52: 0x00
0xCA53: 0x00
0xCA54: 0x00
0xCA55: 0x00
0xCA56: 0x00
0xCA57: 0x00
0xCA58: 0x00
0xCA59: 0x00
0xCA5A: 0x00
0xCA5B: 0x00
0xCA5C: 0x00
0xCA5D: 0x00
0xCA5E: 0x00
0xCA5F: 0x00
0xCA60: 0x5E
0xCA61: 0x47
0xCA62: 0x01
0xCA63: 0x55
0xCA64: 0xFF
0xCA65: 0x02
0xCA66: 0x01
0xCA67: 0x73
0xCA68: 0x43
0xCA69: 0x07
0xCA6A: 0xFF
0xCA6B: 0x01
0xCA6C: 0xFF
0xCA6D: 0x00
0xCA6E: 0x00
0xCA6F: 0x78
0xCA70: 0x00
0xCA71: 0x00
0xCA72: 0x00
0xCA73: 0x00
0xCA74: 0x00
0xCA75: 0x00
0xCA76: 0x00
0xCA77: 0x00
0xCA78: 0x00
0xCA79: 0x00
0xCA7A: 0x00
0xCA7B: 0x00
0xCA7C: 0x00
0xCA7D: 0x00
0xCA7E: 0x00
0xCA7F: 0x00
0xCA80: 0x00
0xCA81: 0x0E
0xCA82: 0x00
0xCA83: 0x00
0xCA84: 0x00
0xCA85: 0x00
0xCA86: 0x00
0xCA87: 0x00
0xCA88: 0x00
0xCA89: 0x00
0xCA8A: 0x00
0xCA8B: 0x00
0xCA8C: 0x00
0xCA8D: 0x00
0xCA8E: 0x00
0xCA8F: 0x00
0xCA90: 0x00
0xCA91: 0x00
0xCA92: 0x00
0xCA93: 0x00
0xCA94: 0x00
0xCA95: 0x00
0xCA96: 0x00
0xCA97: 0x00
0xCA98: 0x00
0xCA99: 0x00
0xCA9A: 0x00
0xCA9B: 0x00
0xCA9C: 0x00
0xCA9D: 0x00
0xCA9E: 0x00
0xCA9F: 0x00
0xCAA0: 0x00
0xCAA1: 0x00
0xCAA2: 0x00
0xCAA3: 0x00
0xCAA4: 0x00
0xCAA5: 0x00
0xCAA6: 0x00
0xCAA7: 0x00
0xCAA8: 0x00
0xCAA9: 0x00
0xCAAA: 0x00
0xCAAB: 0x00
0xCAAC: 0x00
0xCAAD: 0x00
0xCAAE: 0x00
0xCAAF: 0x00
0xCAB0: 0x00
0xCAB1: 0x00
0xCAB2: 0x00
0xCAB3: 0x00
0xCAB4: 0x00
0xCAB5: 0x00
0xCAB6: 0x00
0xCAB7: 0x00
0xCAB8: 0x00
0xCAB9: 0x00
0xCABA: 0x00
0xCABB: 0x00
0xCABC: 0x00
0xCABD: 0x00
0xCABE: 0x00
0xCABF: 0x00
0xCAC0: 0x00
0xCAC1: 0x00
0xCAC2: 0x00
0xCAC3: 0x00
0xCAC4: 0x00
0xCAC5: 0x40
0xCAC6: 0x54
0xCAC7: 0x17
0xCAC8: 0x00
0xCAC9: 0x17
0xCACA: 0x00
0xCACB: 0x00
0xCACC: 0x00
0xCACD: 0x00
0xCACE: 0x00
0xCACF: 0x00
0xCAD0: 0x00
0xCAD1: 0x00
0xCAD2: 0x00
0xCAD3: 0x00
0xCAD4: 0x00
0xCAD5: 0x00
0xCAD6: 0x80
0xCAD7: 0x01
0xCAD8: 0x1F
0xCAD9: 0x00
0xCADA: 0x00
0xCADB: 0x00
0xCADC: 0x00
0xCADD: 0x00
0xCADE: 0x00
0xCADF: 0x00
0xCAE0: 0x00
0xCAE1: 0x00
0xCAE2: 0x00
0xCAE3: 0x00
0xCAE4: 0x00
0xCAE5: 0x00
0xCAE6: 0x00
0xCAE7: 0x00
0xCAE8: 0x00
0xCAE9: 0x00
0xCAEA: 0x00
0xCAEB: 0x00
0xCAEC: 0x00
0xCAED: 0x00
0xCAEE: 0x00
0xCAEF: 0x00
0xCAF0: 0x00
0xCAF1: 0x00
0xCAF2: 0x00
0xCAF3: 0x00
0xCAF4: 0x00
0xCAF5: 0x00
0xCAF6: 0x00
0xCAF7: 0x00
0xCAF8: 0x00
0xCAF9: 0x00
0xCAFA: 0x00
0xCAFB: 0x00
0xCAFC: 0x00
0xCAFD: 0x00
0xCAFE: 0x00
0xCAFF: 0x00
0xCC00: 0x00
0xCC01: 0x00
0xCC02: 0x00
0xCC03: 0x00
0xCC04: 0x00
0xCC05: 0x00
0xCC06: 0x00
0xCC07: 0x00
0xCC08: 0x00
0xCC09: 0x00
0xCC0A: 0x00
0xCC0B: 0x00
0xCC0C: 0x00
0xCC0D: 0x00
0xCC0E: 0x00
0xCC0F: 0x00
0xCC10: 0x14
0xCC11: 0x00
0xCC12: 0x03
0xCC13: 0xE7
0xCC14: 0x00
0xCC15: 0x00
0xCC16: 0x14
0xCC17: 0x00
0xCC18: 0x01
0xCC19: 0x90
0xCC1A: 0x00
0xCC1B: 0x00
0xCC1C: 0x16
0xCC1D: 0x00
0xCC1E: 0x00
0xCC1F: 0x8B
0xCC20: 0x00
0xCC21: 0x00
0xCC22: 0x07
0xCC23: 0x00
0xCC24: 0x00
0xCC25: 0x00
0xCC26: 0x00
0xCC27: 0x00
0xCC28: 0x00
0xCC29: 0x00
0xCC2A: 0x04
0xCC2B: 0x00
0xCC2C: 0xC7
0xCC2D: 0xC7
0xCC2E: 0x03
0xCC2F: 0x00
0xCC30: 0x01
0xCC31: 0x00
0xCC32: 0x00
0xCC33: 0x00
0xCC34: 0x07
0xCC35: 0x00
0xCC36: 0x20
0xCC37: 0x28
0xCC38: 0x44
0xCC39: 0x06
0xCC3A: 0x14
0xCC3B: 0x0F
0xCC3C: 0x06
0xCC3D: 0x41
0xCC3E: 0x00
0xCC3F: 0xF0
0xCC40: 0x07
0xCC41: 0x30
0xCC42: 0x00
0xCC43: 0x88
0xCC44: 0xCA
0xCC45: 0x00
0xCC46: 0x00
0xCC47: 0x00
0xCC48: 0x00
0xCC49: 0x00
0xCC4A: 0x02
0xCC4B: 0x00
0xCC4C: 0x00
0xCC4D: 0x00
0xCC4E: 0x00
0xCC4F: 0x00
0xCC50: 0x50
0xCC51: 0x00
0xCC52: 0x00
0xCC53: 0x00
0xCC54: 0x00
0xCC55: 0x00
0xCC56: 0x50
0xCC57: 0x00
0xCC58: 0x00
0xCC59: 0x00
0xCC5A: 0x00
0xCC5B: 0x00
0xCC5C: 0x54
0xCC5D: 0x00
0xCC5E: 0x00
0xCC5F: 0xC7
0xCC60: 0x00
0xCC61: 0x00
0xCC62: 0x00
0xCC63: 0x00
0xCC64: 0x50
0xCC65: 0x00
0xCC66: 0x00
0xCC67: 0x00
0xCC68: 0x00
0xCC69: 0x00
0xCC6A: 0x00
0xCC6B: 0x00
0xCC6C: 0x02
0xCC6D: 0x00
0xCC6E: 0x00
0xCC6F: 0x00
0xCC70: 0x00
0xCC71: 0x00
0xCC72: 0x00
0xCC73: 0x00
0xCC74: 0x00
0xCC75: 0x00
0xCC76: 0x00
0xCC77: 0x00
0xCC78: 0x00
0xCC79: 0x00
0xCC7A: 0x00
0xCC7B: 0x00
0xCC7C: 0x00
0xCC7D: 0x00
0xCC7E: 0x00
0xCC7F: 0x00
0xCC80: 0x03
0xCC81: 0x00
0xCC82: 0x18
0xCC83: 0x9C
0xCC84: 0x00
0xCC85: 0x00
0xCC86: 0x00
0xCC87: 0x00
0xCC88: 0x10
0xCC89: 0x02
0xCC8A: 0x00
0xCC8B: 0x3C
0xCC8C: 0x00
0xCC8D: 0x00
0xCC8E: 0x00
0xCC8F: 0x00
0xCC90: 0x05
0xCC91: 0x02
0xCC92: 0x00
0xCC93: 0xC8
0xCC94: 0x00
0xCC95: 0x00
0xCC96: 0x00
0xCC97: 0x00
0xCC98: 0x04
0xCC99: 0x00
0xCC9A: 0x00
0xCC9B: 0x00
0xCC9C: 0x00
0xCC9D: 0x00
0xCC9E: 0x00
0xCC9F: 0x00
0xCCA0: 0x10
0xCCA1: 0x00
0xCCA2: 0x00
0xCCA3: 0x00
0xCCA4: 0x00
0xCCA5: 0x00
0xCCA6: 0x00
0xCCA7: 0x00
0xCCA8: 0x10
0xCCA9: 0x00
0xCCAA: 0x00
0xCCAB: 0x00
0xCCAC: 0x00
0xCCAD: 0x00
0xCCAE: 0x00
0xCCAF: 0x00
0xCCB0: 0x10
0xCCB1: 0x00
0xCCB2: 0x00
0xCCB3: 0x00
0xCCB4: 0x00
0xCCB5: 0x00
0xCCB6: 0x00
0xCCB7: 0x00
0xCCB8: 0x10
0xCCB9: 0x00
0xCCBA: 0x00
0xCCBB: 0x00
0xCCBC: 0x00
0xCCBD: 0x00
0xCCBE: 0x00
0xCCBF: 0x00
0xCCC0: 0x00
0xCCC1: 0x00
0xCCC2: 0x00
0xCCC3: 0x03
0xCCC4: 0x77
0xCCC5: 0x00
0xCCC6: 0x03
0xCCC7: 0x77
0xCCC8: 0x00
0xCCC9: 0x00
0xCCCA: 0x00
0xCCCB: 0x00
0xCCCC: 0x00
0xCCCD: 0x00
0xCCCE: 0x00
0xCCCF: 0x00
0xCCD0: 0x10
0xCCD1: 0x00
0xCCD2: 0x00
0xCCD3: 0x00
0xCCD4: 0x00
0xCCD5: 0x00
0xCCD6: 0x00
0xCCD7: 0x00
0xCCD8: 0x04
0xCCD9: 0x00
0xCCDA: 0x00
0xCCDB: 0xC8
0xCCDC: 0x00
0xCCDD: 0x00
0xCCDE: 0x00
0xCCDF: 0x00
0xCCE0: 0x10
0xCCE1: 0x00
0xCCE2: 0x00
0xCCE3: 0x00
0xCCE4: 0x00
0xCCE5: 0x00
0xCCE6: 0x00
0xCCE7: 0x00
0xCCE8: 0x10
0xCCE9: 0x00
0xCCEA: 0x00
0xCCEB: 0x00
0xCCEC: 0x00
0xCCED: 0x00
0xCCEE: 0x00
0xCCEF: 0x00
0xCCF0: 0x50
0xCCF1: 0x00
0xCCF2: 0x00
0xCCF3: 0x00
0xCCF4: 0x00
0xCCF5: 0x00
0xCCF6: 0x00
0xCCF7: 0x00
0xCCF8: 0x40
0xCCF9: 0x00
0xCCFA: 0x00
0xCCFB: 0x00
0xCCFC: 0x00
0xCCFD: 0x00
0xCCFE: 0x00
0xCCFF: 0x00
0xE700: 0x00
0xE701: 0x00
0xE702: 0x00
0xE703: 0x00
0xE704: 0x00
0xE705: 0x00
0xE706: 0x00
0xE707: 0x00
0xE708: 0x00
0xE709: 0x00
0xE70A: 0x00
0xE70B: 0x00
0xE70C: 0x00
0xE70D: 0x00
0xE70E: 0x00
0xE70F: 0x00
0xE710: 0x04
0xE711: 0x00
0xE712: 0x03
0xE713: 0x00
0xE714: 0x16
0xE715: 0x11
0xE716: 0x03
0xE717: 0x01
0xE718: 0x00
0xE719: 0x00
0xE71A: 0x00
0xE71B: 0x00
0xE71C: 0x00
0xE71D: 0x00
0xE71E: 0x00
0xE71F: 0x00
0xE720: 0x00
0xE721: 0x00
0xE722: 0x00
0xE723: 0x00
0xE724: 0x00
0xE725: 0x00
0xE726: 0x00
0xE727: 0x00
0xE728: 0x00
0xE729: 0x00
0xE72A: 0x00
0xE72B: 0x00
0xE72C: 0x00
0xE72D: 0x00
0xE72E: 0x00
0xE72F: 0x00
0xE730: 0x00
0xE731: 0x00
0xE732: 0x00
0xE733: 0x00
0xE734: 0x00
0xE735: 0x00
0xE736: 0x00
0xE737: 0x00
0xE738: 0x00
0xE739: 0x00
0xE73A: 0x00
0xE73B: 0x00
0xE73C: 0x00
0xE73D: 0x00
0xE73E: 0x00
0xE73F: 0x00
0xE740: 0x40
0xE741: 0xAB
0xE742: 0x17
0xE743: 0x02
0xE744: 0x00
0xE745: 0x00
0xE746: 0x00
0xE747: 0x00
0xE748: 0x00
0xE749: 0x00
0xE74A: 0x00
0xE74B: 0x02
0xE74C: 0xDA
0xE74D: 0x00
0xE74E: 0x00
0xE74F: 0x00
0xE750: 0x20
0xE751: 0x00
0xE752: 0x00
0xE753: 0x00
0xE754: 0x00
0xE755: 0x00
0xE756: 0x00
0xE757: 0x00
0xE758: 0x00
0xE759: 0x00
0xE75A: 0x00
0xE75B: 0x00
0xE75C: 0x00
0xE75D: 0x00
0xE75E: 0x00
0xE75F: 0x00
0xE760: 0x00
0xE761: 0x00
0xE762: 0x00
0xE763: 0x00
0xE764: 0x19
0xE765: 0x00
0xE766: 0x00
0xE767: 0x00
0xE768: 0x00
0xE769: 0x00
0xE76A: 0x20
0xE76B: 0x00
0xE76C: 0x04
0xE76D: 0x00
0xE76E: 0x00
0xE76F: 0x00
0xE770: 0x00
0xE771: 0x00
0xE772: 0x20
0xE773: 0x00
0xE774: 0x04
0xE775: 0x00
0xE776: 0x00
0xE777: 0x00
0xE778: 0x00
0xE779: 0x00
0xE77A: 0x20
0xE77B: 0x00
0xE77C: 0x04
0xE77D: 0x00
0xE77E: 0x00
0xE77F: 0x00
0xE780: 0x00
0xE781: 0x00
0xE782: 0x00
0xE783: 0x00
0xE784: 0x00
0xE785: 0x00
0xE786: 0x00
0xE787: 0x00
0xE788: 0x00
0xE789: 0x00
0xE78A: 0x00
0xE78B: 0x00
0xE78C: 0x00
0xE78D: 0x00
0xE78E: 0x00
0xE78F: 0x00
0xE790: 0xF9
0xE791: 0xDF
0xE792: 0xFF
0xE793: 0x0F
0xE794: 0x03
0xE795: 0x3B
0xE796: 0x00
0xE797: 0x00
0xE798: 0x00
0xE799: 0x00
0xE79A: 0x00
0xE79B: 0x00
0xE79C: 0x00
0xE79D: 0x00
0xE79E: 0x00
0xE79F: 0x00
0xE7A0: 0x00
0xE7A1: 0x00
0xE7A2: 0x00
0xE7A3: 0x00
0xE7A4: 0x00
0xE7A5: 0x00
0xE7A6: 0x00
0xE7A7: 0x00
0xE7A8: 0x00
0xE7A9: 0x00
0xE7AA: 0x00
0xE7AB: 0x00
0xE7AC: 0x00
0xE7AD: 0x00
0xE7AE: 0x00
0xE7AF: 0x00
0xE7B0: 0x00
0xE7B1: 0x00
0xE7B2: 0x00
0xE7B3: 0x00
0xE7B4: 0x00
0xE7B5: 0x00
0xE7B6: 0x00
0xE7B7: 0x00
0xE7B8: 0x00
0xE7B9: 0x00
0xE7BA: 0x80
0xE7BB: 0x07
0xE7BC: 0x00
0xE7BD: 0x00
0xE7BE: 0x00
0xE7BF: 0x00
0xE7C0: 0x00
0xE7C1: 0x00
0xE7C2: 0x00
0xE7C3: 0x00
0xE7C4: 0x00
0xE7C5: 0x00
0xE7C6: 0x00
0xE7C7: 0x00
0xE7C8: 0x00
0xE7C9: 0x00
0xE7CA: 0x00
0xE7CB: 0x00
0xE7CC: 0x00
0xE7CD: 0x00
0xE7CE: 0x00
0xE7CF: 0x00
0xE7D0: 0x10
0xE7D1: 0x00
0xE7D2: 0x00
0xE7D3: 0x00
0xE7D4: 0x00
0xE7D5: 0x10
0xE7D6: 0x01
0xE7D7: 0x00
0xE7D8: 0x00
0xE7D9: 0x00
0xE7DA: 0xD0
0xE7DB: 0xDD
0xE7DC: 0x00
0xE7DD: 0x56
0xE7DE: 0x00
0xE7DF: 0x00
0xE7E0: 0x00
0xE7E1: 0x00
0xE7E2: 0x00
0xE7E3: 0x00
0xE7E4: 0x0C
0xE7E5: 0x00
0xE7E6: 0x00
0xE7E7: 0xA6
0xE7E8: 0x66
0xE7E9: 0xEE
0xE7EA: 0xEE
0xE7EB: 0x00
0xE7EC: 0x00
0xE7ED: 0x00
0xE7EE: 0x00
0xE7EF: 0x00
0xE7F0: 0x00
0xE7F1: 0x00
0xE7F2: 0x00
0xE7F3: 0x00
0xE7F4: 0x00
0xE7F5: 0x00
0xE7F6: 0x00
0xE7F7: 0x00
0xE7F8: 0x00
0xE7F9: 0x00
0xE7FA: 0x00
0xE7FB: 0x00
0xE7FC: 0xFF
0xE7FD: 0xFF
0xE7FE: 0x00
0xE7FF: 0x00
